Date,Tweet ID,Text,Likes
2022-09-01 23:52:58+00:00,1565487913965592576,@dvrkmode_ @_Boyluke Ohh I just finished doing that 11secs ago😌,0
2022-09-01 23:51:54+00:00,1565487646029545474,@CharMayCry So CVX,3
2022-09-01 23:51:26+00:00,1565487525392977920,@LakeLewis5 @AKChrismarlo @GucciStarboi Anonymous 🙌🏿😂,0
2022-09-01 23:39:48+00:00,1565484597755973643,@unknown_cvx @AKChrismarlo @GucciStarboi Check my profile I no dey post myself talkless of all this sending a pic of someone's room 😒,0
2022-09-01 23:31:40+00:00,1565482552768532481,"#30mCandlesTA4Crypto | 🚨 📈 Highest 14 periods #MFI now:

$GNO ➡️ 98.748
$FUN ➡️ 95.071
$MFT ➡️ 94.675
$CVX ➡️ 94.115
$AKRO ➡️ 92.766

01/09/2022 @ 11:31pm UTC
Follow for regular updates
#cryptotrading #crypto #cryptomarket",0
2022-09-01 23:25:19+00:00,1565480955741032449,"@JonComms @CapcomUSA_ Add in RE Survivor, RE CVX, Dead Aim, Outbreak 1+2 with online support.",2
2022-09-01 23:24:43+00:00,1565480802418245633,"U.S.  Market Movers Thursday
Stay informed: https://t.co/m9nDvKkErg

Dow Stocks
#Dow $DJI #WallStreet 
$JPM $V $AAPL  $GS $AXP $DIS $MSFT 
$MCD $AXP $HD $NKE $BA $MSFT $WMT
$CRM $CVX $CRM $CAT $UNH $DIS $CVX
$WBA $CRM $DOW $TRV $KO  $DOW $PG https://t.co/DknPO7EWFB",0
2022-09-01 23:23:57+00:00,1565480611640385536,"My 10 Strongest Stocks Action Summary: Thu 9/1/22:

  $SNOW:Long/Add
  $OXY:Long/Add
  $XOM:Long/Add
  $BABA:Long/Hold
  $CVX:Long/Add
  $WMT:Out/Short
  $JNJ:Out/Short
  $KO:Out/Short
  $CSCO:Out/Short
  $COST:Out/Short",2
2022-09-01 23:20:02+00:00,1565479625459142656,"Top 18 Trending Searches on market 

🟡🔵⚪️https://t.co/5gPN3FxSvj

$TSLA $MINA $SHIB $AAPL $BNB $BTC $QUICK $ADA $ETH $QQQ $LPT $SFUND $NFY $FB $CVX $ENS https://t.co/CyWA75lX3s",0
2022-09-01 23:05:00+00:00,1565475842549055489,"✅ $CVX: ""Chevron"" mentioned during ClearSign Combustion Corp earnings event https://t.co/pfgE9mkSW3",0
2022-09-02 23:50:55+00:00,1565849786598805504,"👍Top coins of the last hour👍 

🥇 $ATOM $12.65952 📈 2.06412314% 
🥈 $LDO $2.18202 📈 1.75139608% 
🥉 $CVX $5.28222 📈 1.23678637% 
⚪ $FIL $5.81082 📈 0.79129482% 
⚪ $YFI $10101.66768 📈 0.7303951% 

👉 Automate your trading with UpBots https://t.co/D6RttVXa0R",0
2022-09-02 23:34:50+00:00,1565845736398495744,$CVX Awaiting  Buy Signal based off 8 signals on the 15-min chart. Free trial at https://t.co/XPt98Ai7Qt https://t.co/T9CwbVRmzK,0
2022-09-02 23:31:48+00:00,1565844972267610113,"#30mCandlesTA4Crypto | 🚨 📈 Strongest #MACD buy signals now:

$REI ➡️ 0.08%
$CVX ➡️ 0.076%
$NBT ➡️ 0.052%
$POLS ➡️ 0.048%
$DUSK ➡️ 0.03%

MACD crossed above signal
02/09/2022 @ 11:31pm UTC
#cryptocurrencies #trading #cryptotrading #tradingtips",0
2022-09-02 23:30:06+00:00,1565844545484587010,"🔝 Top gainers of the last hour (Out of Top 100) 📈

🥇 #LDO $2.1787 📈 2.04897368% 
🥈 #CVX $5.2810 📈 1.87095336% 
🥉 #YFI $10114.6346 📈 1.18759838% 
4️⃣  #ATOM $12.5742 📈 1.06923052% 
5️⃣  #XMR $153.0941 📈 0.95450175%

Trade #crypto on Binance https://t.co/YF3WzpbYc1",0
2022-09-02 23:25:09+00:00,1565843298715041798,$ABBV $CVX NEW ARTICLE : Stock picks for a tough month https://t.co/Opddv6ol91 Get all the latest $ABBV related news here : https://t.co/QFefYxn1ad https://t.co/xowkmhz8hg,0
2022-09-02 23:20:58+00:00,1565842247337254912,"My 10 Strongest Stocks Action Summary: Fri 9/2/22:

  $SNOW:Long/Add
  $OXY:Long/Buy
  $XOM:Long/Buy
  $BABA:Long/Hold
  $CVX:Long/Buy
  $JNJ:Out/Short
  $WMT:Out/Short
  $ABBV:Out/Short
  $UNH:Out/Short
  $WFC:Out/Short",0
2022-09-02 23:12:21+00:00,1565840079448207360,"In 2017 many could only dream of news such as this. Now, no one bats an eyelid. Projects like @Algorand is quietly taking over the space.

$btc $algo $sol $eth $ada $xrp $link $bnb $crv $cvx $htr $qnt $vet $fet $uni $snx $aave $luna",1
2022-09-02 23:07:29+00:00,1565838856741691392,@unknown_cvx @Iamdarlinton21 @JoyisBackAgain Lolzzzz 😁 oh that was a mistake there can't *,0
2022-09-02 23:02:10+00:00,1565837518213419008,"#30mCandlesTA4Crypto | 🚨 📈 Biggest winners this last candle:

$CVX ➡️ 2.12%
$WNXM ➡️ 1.88%
$SANTOS ➡️ 1.81%
$PORTO ➡️ 1.75%
$LDO ➡️ 1.12%

02/09/2022 @ 11:01pm UTC
Follow for regular updates
#cryptotrading #crypto #cryptomarket",0
2022-09-02 23:00:23+00:00,1565837067162046464,"📈 Biggest Gainers (1 hr) 📈
EOS $EOS 2.47% 🔥
Convex Finance $CVX 1.76% 🔥
Optimism $OP 1.19% 🔥
ABBC Coin $ABBC 0.90% 
Monero $XMR 0.76%",0
2022-09-03 23:59:34+00:00,1566214348221329408,#Hedge_Funds #News #Chevron_Corporation_NYSE_CVX_ 5 Best Dividend Stocks to Buy Now https://t.co/w8AlIeTZeg https://t.co/FAC70HioHi https://t.co/ZJ9h7nJBDs,0
2022-09-03 23:54:40+00:00,1566213116568162306,"$cvx   $49,000 a day keeps the 9 to 5 away; For a limited time, we are opening our trading chat-room to the public....&gt; ~
https://t.co/jRE4P5IZC6",0
2022-09-03 23:07:09+00:00,1566201160167481345,"💰💰💰💰💰💰💰💰💰💰💰💰💰💰💰💰💰Congrats to all Team members for making huge gains with Trade Ideas $CVX #CVX 

https://t.co/rEobNg7QQw",0
2022-09-03 23:06:41+00:00,1566201042601140226,@kmets_ @iamllanero Isn’t the vast majority of locked cvx apr from bribes rather than emitted convex?,6
2022-09-03 22:36:25+00:00,1566193426260889600,"@ImKatastrophe Someday, I’ll A-rank CVX.
Someday.",1
2022-09-03 22:27:51+00:00,1566191267037454336,@itzbasito A man Called god&gt;&gt;&gt;&gt;,0
2022-09-03 22:24:39+00:00,1566190461902934017,@ImKatastrophe I didn't know that cover exists for CVX,2
2022-09-03 22:20:15+00:00,1566189353872662528,"The team went absolutely INSANE this week! Multiple 10x, 6x, 3x plays to even count 🚀🚀🚀

When the homework is done, the market rewards you📝

S/o the squad!!! Looking forward to the new month 😎

#TheStrat 
$SPY $SPX $TSLA $NVDA $AMD $META $COST $CVX $AMD $SMH $DDOG $CRWD $OXY https://t.co/XbbUW67Cgx",49
2022-09-03 22:09:53+00:00,1566186746257326088,@onlyDTHUG Werey deh find numbers e still put Hashtag😂,1
2022-09-03 22:02:33+00:00,1566184901078130691,@IEndOfDaysI cvx is a masterpiece i will never not say this,1
2022-09-04 23:37:14+00:00,1566571115354492928,"don't act upon it unless you know what you're doing
$CVX: Something is happening with CVX-USDT #CVX 
ratio ~ 0.79
mc / vol. ratio 0.02
kc vol ~ 1.19
MC 348791814.0
(re)enter @ 5.18118",0
2022-09-04 23:36:35+00:00,1566570953773023235,NASDAQ+Mkt is in Big Trouble:REALITY  $QQQ $AAPL $XLE $XOM $CVX $AMD $NVDA $SPY $MSFT $TSM $INTC $MU $SMH $GOOGL $AMZN $META $SNAP $NFLX $TSLA $F $GM $PTON $COIN $MSTR $ARKK $IWM $HOOD $ROKU $TWTR $PINS $CVNA $FCX $X $CLF $AA $BA $AMC $GME $SQ $PYPL $XLF $C $BAC $JPM $MS $GS $WMT https://t.co/aNNj5kntxo,0
2022-09-04 23:33:13+00:00,1566570105118400513,"Track price increases and where buyers are trading with https://t.co/1fbsW58g32 advanced #cryptoscanner

#BTC #ETH $RVN $HOT $GMT $LINK $SAND $SHIB $LRC $ICP $NEO $BAT $KSM $ADA $HNT $MIOTA $CVX $VET $ALGO $SOL https://t.co/lCZWhD9l7K",0
2022-09-04 22:11:29+00:00,1566549537745141760,"$cvx     $49,000 a day keeps the 9 to 5 away; For a limited time, we are opening our trading chat-room to the public..&gt; ~
https://t.co/R081xf70zc",0
2022-09-04 22:09:34+00:00,1566549054469062657,"🔥 New Algo detection: CVX/USDT 🔥

🕛 09-04-2022 22:09:34
🚀 $CVX
📈 Current Price: 5.27 $USDT
⏩ Exchange: #Kucoin

No Investment Advice.
Follow us on Twitter.
#Crypto #Algo #CVX",0
2022-09-04 22:00:04+00:00,1566546662427766785,"Cryptolume Momentum Scanner Results

#CVX_USDT ↑3.25% in price &amp; ↑109.29% in volume the last 4hrs
#ALICE ↑2.19% in price &amp; ↑57.14% in volume the last 4hrs
#CLV_EUR ↑1.88% in price &amp; ↑2.93% in volume the last 30mins

Visit https://t.co/PCYdykQHoa for more alerts.",0
2022-09-04 22:00:00+00:00,1566546647055605761,"Top #Cryptocurrency RANK UP (#crypto #bitcoin #altcoin):
$LRC+2 $ANKR+2 $MANA+2 $CAKE+2 $CEL+2 $KSM+2 $SHIB+1 $COMP+1 $CVX+1 $PAXG+1 $BAT+1 $XEM+1 $SAND+1 $BTG+1 $USDD+1 $RUNE+1 $GALA+1 $HBAR+1
https://t.co/u2nM5wvf3K",0
2022-09-04 21:32:09+00:00,1566539639304896512,"📢VOD NOW AVAILABLE! 9/3 #TWITCH STREAMS!📢

1⃣1PM - https://t.co/iTLlX1oJsA #ResidentEvil CVX
2⃣7PM - https://t.co/lyI9fTqqyN #ResidentEvilRemake

The 7PM stream was absolutely insane.

https://t.co/d0CtKbvSfi

#Stadia #TeamStadia #Xbox #PS5 #Steam #Stadia1000 https://t.co/MXKCGkO7pN",13
2022-09-04 21:25:26+00:00,1566537949428101120,"@REZcsgo Very impressive match,  great AWP plays. GG",0
2022-09-04 21:06:44+00:00,1566533240764223489,"Sector diversification is critical for a dividend growth portfolio. Here’s some of the best:

Cons Disc.
$HD
$MCD

Cons Staple
$PEP
$PG

Tech
$MSFT
$TXN

Comm
$VZ

Health
$JNJ
$ABBV

REIT
$O
$STOR

Financial
$JPM
$BLK

Industrial
$LMT
$WM

Energy
$CVX

Utility
$ED

Material
$LYB",290
2022-09-05 23:59:02+00:00,1566938989885784067,"📉$148.4K $CVX SHORTED @$5.3469📉

Sentiment:
1H: 📈Bullish",1
2022-09-05 23:58:14+00:00,1566938790534549505,"don't act upon it unless you know what you're doing
$CVX: Something is happening with CVX-USDT #CVX 
ratio ~ 0.85
mc / vol. ratio 0.02
kc vol ~ 1.11
MC 352821628.0
(re)enter @ 5.24238",0
2022-09-05 23:55:25+00:00,1566938082636664832,"@unknown_cvx @Tolulop_ @Muzino9 @Kingpresh01 @Badboytimz @Hydro_jr If you think so ,,, still better than the okirika of 250 🤫🤫",0
2022-09-05 23:50:46+00:00,1566936912018931713,"[Scan results - #FTX - 15m]

Top 5 bullish trends on $PERP pair
1: $MTL
2: $ALT
3: $SUSHI
4: $FXS
5: $CVX

Top 3 bullish trends on $USD pair
1: $BITW
2: $ETHE
3: $GBTC

All FTX results: https://t.co/ypxjbS79IW
Not buy signals. #DYOR",0
2022-09-05 23:46:33+00:00,1566935851719950336,"[Scan results - #FTX - 15m]

Top 5 bullish trends on $PERP pair
1: $MTL
2: $ALT
3: $SUSHI
4: $FXS
5: $CVX

Top 3 bullish trends on $USD pair
1: $BITW
2: $ETHE
3: $GBTC

All FTX results: https://t.co/kFG8XpNRPZ
Not buy signals. #DYOR",0
2022-09-05 23:40:46+00:00,1566934394832650241,"[Scan results - #FTX - 15m]

Top 5 bullish trends on $PERP pair
1: $CVX
2: $SUSHI
3: $CHR
4: $REN
5: $ETC

All FTX results: https://t.co/ypxjbS79IW
Not buy signals. #DYOR",0
2022-09-05 23:31:51+00:00,1566932149755736065,"Track where buyers are locking in their trades during this bull run with https://t.co/1fbsW58g32

#BTC #ETH $USTC $ETC $FLUX $RVN $BTG $BCH $EOS $CRV $CEL $UNI $QTUM $LINK $AAVE $ETH $GNO $CVX $BSV $YFI https://t.co/6sxhnbmU3B",0
2022-09-05 23:31:37+00:00,1566932092944015363,"[Scan results - #FTX - 15m]

Top 5 bullish trends on $PERP pair
1: $CVX
2: $SUSHI
3: $CHR
4: $REN
5: $ETC

All FTX results: https://t.co/kFG8XpNRPZ
Not buy signals. #DYOR",0
2022-09-05 23:31:36+00:00,1566932089391292417,"18/  ICYMI Reserve is entering in the “Curve Wars” and quietly laddering up CVX leaderboard

https://t.co/C34EjKZ8ye",14
2022-09-05 23:25:04+00:00,1566930444997857280,@onlyDTHUG @Spotlight_Ebony @ade_ade030 @breezyIzback @Austindrille1 Quit cheap weed.,1
2022-09-06 23:50:18+00:00,1567299179935825920,@GlobalClean_1 Nice work $f $cvx and especially $gceh for winning with the big dogs. #lowfloat,1
2022-09-06 23:49:35+00:00,1567298998955810817,"$XLE over 43% of ETF weighted in $XOM and $CVX

Calls above $79.55
Puts below $79.14 

European Energy Crisis... Have a feeling we are gonna wake up to a huge gap up one of these days... https://t.co/9TmFfyN0M6",7
2022-09-06 23:46:36+00:00,1567298248347361280,"🚀@MoonbeamNetwork $GLMR RIDICULOUSLY UNDERVALUED!🤑 
#bitcoin $SPY $DOGE $AVA #news #ethereum $AAPL $NVDA $TSLA $AMZN #WSB #OOTT $GLD $HBAR $QQQ $AMC $FB #wallstreetbets $GME $AXS $ICP $SHIB $GRT $CAKE $XRP #DDTG 
$MINA $SHIB $QUICK $LPT $SFUND $NFY $CVX $ENS $ERG $ETC #gaming https://t.co/GzpFCaqQgf",2
2022-09-06 23:33:10+00:00,1567294868984061952,"1. EU - Russia Gas Headlines from 2006

2. Russia and Europe's Mutual Energy Dependence 2010

Round and round we go... 

Markets cycle, Headlines cycle, Stay focused(I'm trying)

$SPX $SPY $XLE $QQQ $VOO $USO $XOM $CVX

https://t.co/LpWnhMEqwY https://t.co/sqys980HJo",2
2022-09-06 23:31:58+00:00,1567294565861801984,"#30mCandlesTA4Crypto | 🚨👀 Weakest #cryptotrends (6 periods #ADX) now:

$CVX ➡️ 15.98
$VGX ➡️ 16.515
$ALPINE ➡️ 19.739
$KNC ➡️ 20.208
$OCEAN ➡️ 20.336

06/09/2022 @ 11:31pm UTC
Follow for regular updates
#cryptotrading #crypto #cryptomarket",0
2022-09-06 23:24:34+00:00,1567292703452307457,"@Sticki_Dicky @Votium Defi... Seriously, just ask of you have a question. $cvx is a gangsta!",0
2022-09-06 23:06:37+00:00,1567288187353014273,"My 10 Strongest Stocks Action Summary: Tue 9/6/22:

  $SNOW:Long/Add
  $OXY:Long/Add
  $XOM:Long/Add
  $BABA:Long/Add
  $CVX:Long/Add
  $JNJ:Out/Sell Short
  $ABBV:Out/Sell Short
  $WMT:Out/Short
  $UNH:Out/Short
  $WFC:Out/Short",0
2022-09-06 23:01:50+00:00,1567286983470219265,"#30mCandlesTA4Crypto | 🚨👀 Weakest #cryptotrends (6 periods #ADX) now:

$CVX ➡️ 17.927
$VGX ➡️ 18.828
$OCEAN ➡️ 20.667
$CHR ➡️ 20.773
$ALPINE ➡️ 20.958

06/09/2022 @ 11:01pm UTC
Follow for regular updates
#cryptotrading #crypto #cryptomarket",0
2022-09-06 23:01:48+00:00,1567286977204043777,"#30mCandlesTA4Crypto | 🚨 📈 Highest 14 periods #MFI now:

$TRIBE ➡️ 73.967
$AGLD ➡️ 68.513
$CVX ➡️ 66.32
$BICO ➡️ 62.777
$MKR ➡️ 58.594

06/09/2022 @ 11:01pm UTC
Follow for regular updates
#cryptotrading #crypto #cryptomarket",0
2022-09-06 22:59:12+00:00,1567286321630134273,"""Net-Zero Has Chevron Investors Laughing All The Way To The Bank (NYSE:CVX)"" via @SeekingAlpha

Trending #convexfinance news with frequent shares and strong engagement across social media.

Social Insights: https://t.co/xLefyaTtDN $cvx

Source👇https://t.co/myBKRkNPJp",0
2022-09-07 23:49:09+00:00,1567661279762083841,"$cvx   Top analyst price target for next week~
https://t.co/Sz8M29EimJ",0
2022-09-07 23:44:30+00:00,1567660108359811072,"Trending: DJIA

$AAPL 0.91 %
$GS 1.15 %
$INTC 1.05 %
$WMT 2.57 %
$MSFT 1.99 %
$MMM 3.23 %
$JNJ 0.91 %
$CAT 0.33 %
$CVX -1.27 %
$BA 2.34 %

https://t.co/WV3qS0l6fi",0
2022-09-07 23:43:01+00:00,1567659735268167688,"$CVX  Has a Forecast PEADrift price projection for the next 58 days of $157.12. Max price $187.33, Mean $160.73 and Min $145.07. You can check here https://t.co/6ogm3idYde https://t.co/8SM7diLDo7",0
2022-09-07 23:42:30+00:00,1567659607937683457,this has been flat long enough and $crv is up 13% today. time to move $cvx https://t.co/voEUmSEoXV,0
2022-09-07 23:41:54+00:00,1567659453247283204,Oversold QQQ &gt; 301 could go to 307 to 313  $AAPL $QQQ $XLE $XOM $CVX $SMH $AMD $NVDA $MSFT $TSM $INTC $MU $GOOGL $AMZN $META $SNAP $NFLX $TSLA $F $GM $PTON $COIN $MSTR $ARKK $IWM $HOOD $ROKU $TWTR $PINS $CVNA $FCX $X $CLF $AA $BA $AMC $GME $SQ $PYPL $XLF $C $BAC $JPM $MS $GS $WMT https://t.co/Y6rBZmP1AR,0
2022-09-07 23:24:17+00:00,1567655021449302023,"Trending: DJIA

$AAPL 0.96 %
$GS 1.25 %
$INTC 1.05 %
$WMT 2.67 %
$MSFT 2.04 %
$MMM 3.77 %
$JNJ 0.71 %
$CAT 0.33 %
$CVX -1.21 %
$BA 2.40 %

https://t.co/WV3qS0l6fi",0
2022-09-07 23:21:29+00:00,1567654316126748676,Right someone get me a PS3 Japan account and we will do CVX😂,0
2022-09-07 23:05:51+00:00,1567650384432201733,@Bigwiz08081 @CHopmass See gap 😂,1
2022-09-07 23:04:23+00:00,1567650013072818177,"Trending: DJIA

$AAPL 0.96 %
$GS 1.25 %
$WMT 2.57 %
$INTC 1.05 %
$MSFT 2.00 %
$MMM 3.39 %
$JNJ 0.55 %
$CAT 0.11 %
$CVX -1.28 %
$BA 2.34 %

https://t.co/WV3qS0l6fi",0
2022-09-07 22:55:26+00:00,1567647762283380736,"@unknown_cvx @DRDammy4 fact about what exactly, use your head not your mouth to think bruv",0
2022-09-08 23:35:48+00:00,1568020306069192704,"Energy-related stocks finished higher today led by Lithium stocks.

$CVX is up 0.54%
$OXY is down 1.25%
$AR is up 3.64%
$BTU is down 4.89%
$ENPH is up 0.35%
$FSLR is up 2.03%
$CCJ is up 2.62%
$ALB is up 4.38%
$LTHM is up 4.46%",0
2022-09-08 23:35:38+00:00,1568020265522561026,"@wizkidayo you do this one ooo,Oya na.",0
2022-09-08 23:34:44+00:00,1568020037725786118,"$GTII  $IBM $EXAS $JNJ $MRK $LLY $BMY $MU $PTON $BYND $PLUG $MARA $GOOG $AMZN $JPM $WYNN $BYD $TLRY $EYES $EKSO $OSTK $NVDA $AMD  $CVX $VERI $IZEA $FCEL $SRAX $MDXG $PRTA $OMCS $KOPN $APPS
$CYDY $MO

Watch and learn how WALL ST STEALS 

https://t.co/KVnlXZrsNs",3
2022-09-08 23:31:45+00:00,1568019290712084481,"U.S  market movers Thursday
Stay informed: https://t.co/m9nDvKCNFo

Dow Stocks
#Dow $DJI #WallStreet 
$JPM $V $AAPL  $GS $AXP $DIS $MSFT 
$MCD $AXP $HD $NKE $BA $MSFT $WMT
$CRM $CVX $CRM $CAT $UNH $DIS $CVX
$WBA $CRM $DOW $TRV $KO  $DOW $PG https://t.co/6fm4beuUd7",0
2022-09-08 23:27:37+00:00,1568018247064367104,"For anyone farming stablecoins, on Convex Finance you can currently get ~10-60% APY in safe stablecoins

It's on the frax portion of Convex site here: https://t.co/uQEttTqTJd 

These pools are routed through Convex, then Frax, then Curve. 

So you get $CRV + $CVX + $FXS rewards",43
2022-09-08 23:10:48+00:00,1568014016467062786,$CVX: Chevron granted an interest in three greenhouse gas assessment permits offshore Australia https://t.co/byKlgBSfkR,0
2022-09-08 23:10:23+00:00,1568013911563042818,"Enjoy breakfast with us at #TCT2022 as @adnanalkhouli and Drs. Singh, Price, and Sanchez discuss the advantages of 3D intracardiac echocardiography guidance using our VeriSight Pro Catheter and industry-leading EPIQ CVx. Save your spot at https://t.co/mfejStgVez https://t.co/MjF9eLDh2G",13
2022-09-08 23:09:31+00:00,1568013694831034368,LUNC the price is rising but should you invest now? https://t.co/wN7uIwhqxb $gme $ame $SLB $HAL $BKR $TS $NOV $CHX $VAL $FTI $WHD $WFRD $LBRT $XPRO $USAC $NEX $RES $OII $AROC $CLB $PUMP $DNOW $VTOL $DRQ $WTTR $SLCA $BOOM $SHEL $XOM $CVX,0
2022-09-08 23:08:06+00:00,1568013338826743810,@BSundayare Na lack of bragging normal normal Na YBNL him be,1
2022-09-08 22:57:01+00:00,1568010546762469377,"#CVXUSDT Bull Alert!

5X Volume
Price:      5.33
5-min %: 1.1%
Volume:  $19,985
 
#crypto #whale #btc #eth #CVX $CVX https://t.co/t04s9LM25X",0
2022-09-09 23:51:06+00:00,1568386547627737089,@Jones__0000 @Mista_Mdee L wey you don chop today Reach 40😂,4
2022-09-09 23:45:13+00:00,1568385066451042305,@leinadola @HIBEE1980 Them suppose sack the editor😂,5
2022-09-09 23:31:56+00:00,1568381724731514880,"#30mCandlesTA4Crypto | 🚨 Strongest 6 periods #RSI #BuySignals now:

$FTT ➡️ 24.326
$CVX ➡️ 27.659
$SOL ➡️ 27.83
$VIDT ➡️ 28.331
$QNT ➡️ 28.609

09/09/2022 @ 11:31pm UTC
Follow for regular updates
#cryptotrading #crypto #cryptomarket",0
2022-09-09 23:31:05+00:00,1568381508750024705,@AKChrismarlo Come learn better editing here Oponu.,6
2022-09-09 23:22:42+00:00,1568379397802958848,"When mfs have ask me if my Crypto investments allow to play high in my life style 

Greetings from Singapore in #MarineBay hotel in my 8k .

Still printing money @cryptosmartofc #RealYield $Crv $Cvx $Gmx $Gns $Spell https://t.co/gwGRMq9z1S",4
2022-09-09 23:21:00+00:00,1568378971242528772,"$CVX made it on to the Best Stocks list with an Earning Momentum of 31.0, market capitalization 284465.0 and a perfect timing 2.1. Check https://t.co/5AyM9DMpIw https://t.co/rS74Qyj0FN",0
2022-09-09 22:09:27+00:00,1568360967184216065,"🚀@MoonbeamNetwork $GLMR ... UP UP... AND ..AWAAY!!🤑  
#Bitcoin #SPY $DOGE $AVA #news #ethereum $AAPL $NVDA $TSLA $AMZN #WSB #OOTT $GLD $HBAR $QQQ $AMC $FB #wallstreetbets $GME $AXS $ICP $SHIB $GRT $CAKE $XRP #DDTG 
$MINA $SHIB $QUICK $LPT $SFUND $NFY $CVX $ENS $ERG $ETC #gaming https://t.co/EwmzU6q7iQ",1
2022-09-09 22:04:47+00:00,1568359789486391298,"💰💰💰💰💰💰💰💰💰💰💰💰💰💰💰💰💰Congrats to all Team members for making huge gains with Trade Ideas $CVX #CVX 

https://t.co/rEobNg7QQw",0
2022-09-09 22:02:05+00:00,1568359110009307136,MLB CVX Ball Mark Repair Tool &amp; 2 Ball Markers #OriolesBaseball #OriolesMagic #BirdLand #IBackTheBirds #GoOrioles https://t.co/Js2Drtkeyu,0
2022-09-09 22:00:01+00:00,1568358589873684481,"Biggest Mega-Cap Gainers for Sep 09, 2022:
$META +4.38%
$TSLA +3.60%
$BABA +2.93%
$NVDA +2.84%
$AMZN +2.66%
$CVX +2.58%
$DIS +2.54%
$MSFT +2.30%
$V +2.24%
$GOOG +2.16%

Research on https://t.co/Y2cUknKdo2",0
2022-09-10 23:54:50+00:00,1568749872312107010,"#CVXUSDT Bull Alert!

30X Volume
Price:      5.684
5-min %: 0.42%
Volume:  $198,606
 
#crypto #whale #btc #eth #CVX $CVX https://t.co/qbsEPVBSoc",0
2022-09-10 23:52:47+00:00,1568749355754229760,"#CVXUSDT Bull Alert!

20X Volume
Price:      5.684
5-min %: 0.42%
Volume:  $134,654
 
#crypto #whale #btc #eth #CVX $CVX https://t.co/yFv75Vb4WX",0
2022-09-10 23:51:55+00:00,1568749140879843336,"#CVXUSDT Bear Alert!

15X Volume
Price:      5.65
5-min %: -0.18%
Volume:  $99,821
 
#crypto #whale #btc #eth #CVX $CVX https://t.co/SmzA1LCcsJ",0
2022-09-10 23:36:32+00:00,1568745269113802759,"Mega Cap Companies trading above 200 Days SMA yielding 3% more, kind of safer bet for 
investors with risk aversion mentality: $CVX, $MRK, $XOM",1
2022-09-10 23:32:05+00:00,1568744148882329600,"#CRYPTOCURRENCIES are MOVING! Try https://t.co/1fbsW5qpha to scan for #altcoin and #bitcoin movements.

#BTC #ETH $LUNA $HNT $EOS $WAVES $CRV $CVX $GRT $LTC $COMP $UNI $ETH $CRO $ADA $LINK $LDO $SHIB $AAVE $RVN https://t.co/Uqcjy3HJyE",1
2022-09-10 23:31:47+00:00,1568744072801669127,"#30mCandlesTA4Crypto | 🚨 📈 Highest 14 periods #MFI now:

$BTG ➡️ 96.823
$MC ➡️ 95.152
$GNO ➡️ 94.361
$CVX ➡️ 93.21
$ETH ➡️ 90.637

10/09/2022 @ 11:31pm UTC
Follow for regular updates
#cryptotrading #crypto #cryptomarket",0
2022-09-10 23:31:10+00:00,1568743916702420992,"[Scan results - #Binance - 15m]

Top 5 bullish trends on $BTC pair
1: $KNC
2: $OAX
3: $RVN
4: $WABI
5: $CVX

Top 5 bullish trends on $USDT pair
1: $LINK
2: $QI
3: $TRX
4: $JST
5: $IRIS

All Binance results: https://t.co/NE27I4C0Dl
Not buy signals. #DYOR",2
2022-09-10 23:22:12+00:00,1568741661580341250,"🤖🔔 LONG $CVX (CVXUSDT) || Detected pattern: Rebound (1 hour) [11-Sep 01:22] || Level: ★ ☆ ☆ 

 Full alert👇:
 https://t.co/fP9HESEaDd https://t.co/s6QAX3NojO",0
2022-09-10 23:11:39+00:00,1568739006044868613,"@JonGalt14 @bneiluj @lxhxr @defiwars_ Imo it’s mainly the same difference as between a 100% collateralised stable coin v/s an algorithmic stable coin. CVX is backed by the locked CRV, so cvxCRV is not really backed by CRV. On the other hand, sdCRV holder can vote for stopping the relock of CRV and get them back in 4Y",6
2022-09-10 23:11:34+00:00,1568738986969145346,"@golfingmedic Thanks, Don! My scan on https://t.co/BgrdSyOOnW from @runstrat showed the same last night. Many bullish weekly reversal setups, especially in semis (SMH, AMD, MU) and oil names like XOM, CVX, SHEL. Makes sense, with the indices similar setups. I'll post the best ones tomorrow!",0
2022-09-11 23:44:39+00:00,1569109699609370625,That’s it I need to play cvx myself and not only watch gameplay on YouTube..,1
2022-09-11 23:19:06+00:00,1569103270362189825,"cvx claire you will ALWAYS be famous
https://t.co/LBnGxVKioT",4
2022-09-11 23:01:34+00:00,1569098855626440705,cvx my fav re game and dsc claire my fav claire... like this is perfect,1
2022-09-11 23:00:33+00:00,1569098602647109633,CVX AND DSC TOP 2 YOU GUYS IM SO HAPPY,4
2022-09-11 22:55:02+00:00,1569097210373050368,"im guessing cvx is 3rd, re2r 2nd place and dsc claire is 1st place",3
2022-09-11 22:34:42+00:00,1569092095390150656,"High dividends and persevering contributions lead to enormous results. Investing $350 per month into Chevron $CVX for the past 35 years would result in $100,000 in annual dividends today plus a $2.6 million holding value. That gives you a lot of favorable choices throughout life.",91
2022-09-11 22:31:38+00:00,1569091323046797313,@afeni01 @RollingStone @davido You should be using your sleepless night for better things,0
2022-09-11 22:30:51+00:00,1569091126791122945,@smile_david7 @RollingStone @davido_global @davido Blud is not even listening 😭,0
2022-09-11 22:30:13+00:00,1569090968279719936,"Last #Signal Results  
  
#BCH    65.63%
$KAVA    0.16%
#CVX    32.89%
#ENS    48.95%
#FLOW    48.62%
#DENT    87.94%
$ENS    70.25%
$PEOPLE    70.59%
#SAND    12.70%
$BEL    42.76%
  
All Details on Bio Total Profit  480.49%",0
2022-09-11 22:30:13+00:00,1569090965058494467,"Last #Signal Results  
  
#BCH    65.63%
$KAVA    0.16%
#CVX    32.89%
#ENS    48.95%
#FLOW    48.62%
#DENT    87.94%
$ENS    70.25%
$PEOPLE    70.59%
#SAND    12.70%
$BEL    42.76%
  
All Details on Bio Total Profit  480.49%",0
2022-09-12 23:59:29+00:00,1569475819017490433,$CVX Everyone is Buying the Dip Right Now.Hoarding Shares.  https://t.co/rbw6oXP30s,0
2022-09-12 23:54:26+00:00,1569474548764143616,"@HyenukChu Ctra, mrk, cvx, nsc, hum, unh",0
2022-09-12 23:31:39+00:00,1569468814315732994,"#30mCandlesTA4Crypto | 🚨👀 Strongest #cryptotrends (6 periods #ADX) now:

$BTTC ➡️ 93.244
$CVX ➡️ 84.307
$CVP ➡️ 79.723
$HBAR ➡️ 78.541
$AUTO ➡️ 76.715

12/09/2022 @ 11:31pm UTC
Follow for regular updates
#cryptotrading #crypto #cryptomarket",0
2022-09-12 23:31:36+00:00,1569468800768114688,"#30mCandlesTA4Crypto | 🚨 📉 Lowest 14 periods #MFI now:

$PAXG ➡️ 7.892
$TROY ➡️ 8.557
$RARE ➡️ 12.432
$CVX ➡️ 12.434
$STMX ➡️ 12.572

12/09/2022 @ 11:31pm UTC
Follow for regular updates
#cryptotrading #crypto #cryptomarket",0
2022-09-12 23:20:24+00:00,1569465984221675520,"🔴 DUMP #CVX from 5.76 to 5.29 #USDT  = -8.15 %

Cryptocurrency Change Value
4h (5.38) = -0.93%
24h (5.54) = -3.79%
7d (5.38) = -0.93%
30d (7.2) = -25.97%
90d (4.09) = 30.32%
360d (44.49) = -88.02%

#Binance #ConvexFinance #CVXUSDT #dump #token https://t.co/1YRUPsxk44",1
2022-09-12 23:03:04+00:00,1569461621701103617,Wall Street USA Markets Better Valuation For 09/13/22 $FDX $UPS $DE $CAT $OXY $XOM $CVX $HES $AMZN $AAPL $SHEL $SUN $BP $UNP $PSX $COP $TSLA $RIVN $F $GM $LCID $LAD $RCL $CCL $NCLH $DIS $SBUX $CRM $CMG $DWAC $CMCSA $T $ASIX $PLD $DFS $PTON $SNAP @SquawkCNBC @SquawkStreet @markets,1
2022-09-12 23:02:05+00:00,1569461376342433794,"#30mCandlesTA4Crypto | 🚨👀 Strongest #cryptotrends (6 periods #ADX) now:

$BTTC ➡️ 92.808
$CVP ➡️ 84.07
$CVX ➡️ 82.381
$REI ➡️ 80.43
$GTC ➡️ 78.409

12/09/2022 @ 11:02pm UTC
Follow for regular updates
#cryptotrading #crypto #cryptomarket",0
2022-09-12 23:02:02+00:00,1569461362283216896,"#30mCandlesTA4Crypto | 🚨 📉 Lowest 14 periods #MFI now:

$TRIBE ➡️ 9.494
$RARE ➡️ 10.139
$ALCX ➡️ 10.486
$CVX ➡️ 10.611
$STMX ➡️ 11.068

12/09/2022 @ 11:02pm UTC
Follow for regular updates
#cryptotrading #crypto #cryptomarket",0
2022-09-12 22:49:18+00:00,1569458156094521346,"U.S  market movers Monday
Stay informed: https://t.co/m9nDvKCNFo

Dow Stocks
#Dow $DJI #WallStreet 
$JPM $V $AAPL  $GS $AXP $DIS $MSFT 
$MCD $AXP $HD $NKE $BA $MSFT $WMT
$CRM $CVX $CRM $CAT $UNH $DIS $CVX
$WBA $CRM $DOW $TRV $KO  $DOW $PG https://t.co/BueZSm70ig",0
2022-09-12 22:31:53+00:00,1569453774883721219,"#30mCandlesTA4Crypto | 🚨👀 Strongest #cryptotrends (6 periods #ADX) now:

$BTTC ➡️ 92.286
$CVP ➡️ 83.034
$GTC ➡️ 82.326
$CVX ➡️ 80.224
$REI ➡️ 78.335

12/09/2022 @ 10:31pm UTC
Follow for regular updates
#cryptotrading #crypto #cryptomarket",0
2022-09-13 23:54:41+00:00,1569837000110252032,@NuJhayhne @DiianaD_ Point of correction 50k https://t.co/6XKyprAGCh,0
2022-09-13 23:48:15+00:00,1569835380534542337,"Top 18 Trending Searches on market 

https://t.co/f73pUCUCpQ

$TSLA $MINA $SHIB $AAPL $BNB $BTC $QUICK $ADA $ETH $QQQ $LPT $SFUND $NFY $FB $CVX $ENS https://t.co/dS3UVgLa0P",3
2022-09-13 23:47:40+00:00,1569835233008041985,$BP $CVX $NU $INFY $TME $SCHW $PDD All that you need to know. Shorts haven't covered a single share-  https://t.co/xtCAgB0uze,0
2022-09-13 23:46:41+00:00,1569834987683254272,"7 Undervalued Blue-Chip Stocks to Buy Now

$TGT $GOOG $CVX $AMD  

https://t.co/Q9oNHzWsH8",2
2022-09-13 23:35:20+00:00,1569832131907534850,$BP $CVX $NU $INFY $TME $SCHW $PDD All that you need to know. Shorts haven't covered a single share  https://t.co/xtCAgB0uze,0
2022-09-13 23:33:15+00:00,1569831605107326976,@unknown_cvx @Sakagadgets @DRDammy4 @Champ_indeed Feel Wetin ? 😂😂😂😂😂,0
2022-09-13 23:31:07+00:00,1569831066822639625,"@boihayce @Sakagadgets @DRDammy4 @Champ_indeed You deh feel am Abi,Continue.",0
2022-09-13 23:28:48+00:00,1569830484498169856,@boihayce @unknown_cvx @DRDammy4 @Champ_indeed You sef dey stream am abi 🔥🔥🔥,0
2022-09-13 23:26:24+00:00,1569829883223711745,"Wellp it’s official. This pullback has been enough for me to start positions in:

$CVX, $TGT, $IBM, $LIN, $HAS, $BF.A, $TXN, $LOW, $HD, $CLX, $DE, $CAT, $ADP, $MRK, $AMGN, $O, $CAG, $ABT, $V, $MA, $NKE, $SBUX, $EBAY, $LMAR, $CSCO

Throwing $500 into these tomorrow on @M1Finance",8
2022-09-13 23:24:10+00:00,1569829321178595329,"@Sakagadgets @unknown_cvx @DRDammy4 @Champ_indeed Go listen to your man mid song again, wa je ogede 😂",0
2022-09-14 23:50:13+00:00,1570198261255872513,"$XLE Fly or Die? $XOM $CVX $OXY

Winter is coming... Shout out to @Weekly_Chart for the eyes. https://t.co/p4FDlB6wHT",18
2022-09-14 23:46:27+00:00,1570197313649516544,"$OXY $CVX Largest oil-and-gas lease offering in history
""Bad Hair Day"" for #DiNapoli+his network of comptrollers misusing their power by punishing companies that do not comply their arbitrary #ESG. Time to free pension funds of these guys by reorganzing comptroller jurisdictions. https://t.co/UIHP3kubmb",0
2022-09-14 23:40:08+00:00,1570195727808069632,Daily chart bullish swing flagged for $CVX on 09-14-2022 calculated after market close with unusual options flow. #bullishswing #CVX #unusualoptionsflow https://t.co/UpcTf3k3M2,0
2022-09-14 23:03:56+00:00,1570186615896657921,@IBn_ibraheem14 @unknown_cvx @Arekunmi @Smart3O @_AsiwajuLerry @davido Una no go kill person for this app. Lmao 🤣,1
2022-09-14 22:55:25+00:00,1570184471202402306,"$ETH Sentiment

What will happen after the #Merge?

$SOL $ARKK $CRV $AVAX $ADA $BNB $FTM $MATIC $SPY $SHIB $DOGE $SPY $GME $AAPL $TSLA $XRP $NEAR $LINK $FTT $APE $AXS $ZIL $CVX $FRAX $NVDA $LOOKS $UNI $HBAR $ALGO $DOT $QQQ $CRO $ATOM $VET $EGLD $RUNE $ZEC $QNT $USDT #NFT #BAYC",0
2022-09-14 22:47:40+00:00,1570182520217665538,"Top 30 Trending Searches on #CRYPTO market 
https://t.co/8qG100MJdE

$MINA $SHIB $MATIC $SOL $BNB $BTC $QUICK $ADA $ETH $LPT $SFUND $NFY $CVX https://t.co/c4BZNqqEIN",1
2022-09-14 22:37:15+00:00,1570179899343900672,"We are glad to help this member reach his goal. Check out what he said in his updated review of our server https://t.co/ZBTRgq18CE

$CMCSA $PEP $SAP $XOM $ABBV $ABT $TM $CRM $ORCL $CVX $ASML $LLY $TMO $AMGN $AZN $NKECHL $COST $MCD $ACN $BMY $DHR $NEE $SNY $CHTR $MDT $TMUS https://t.co/6hPJtURMFx",0
2022-09-14 22:31:45+00:00,1570178515730923522,"#30mCandlesTA4Crypto | 🚨👀 Strongest #cryptotrends (6 periods #ADX) now:

$FIRO ➡️ 66.246
$CVP ➡️ 65.23
$TRIBE ➡️ 61.027
$PAXG ➡️ 60.892
$CVX ➡️ 56.523

14/09/2022 @ 10:31pm UTC
Follow for regular updates
#cryptotrading #crypto #cryptomarket",0
2022-09-14 22:30:06+00:00,1570178102420013061,"Nice print for $CVX Size: 1099790 Price: 163.27 Amount: $179,562,713.30 Time: 1830
See more: https://t.co/ckDL2K0gVd
Join https://t.co/JWvlYbdLod to get REAL TIME prints.
Runners 📈: https://t.co/VC1LdPHaJR
Losers 📉: https://t.co/9MWV4THfhQ
Gappers 🪜: https://t.co/bHQKF1W40n",0
2022-09-14 22:24:17+00:00,1570176635848228864,"DOW $DIA Top Gainers during today  $CVX $JNJ $MRK $CRM 
        
Learn more: https://t.co/kcKVVyb4LM https://t.co/YCCNtTfPR2",0
2022-09-15 23:50:54+00:00,1570560823894102016,"Top 30 Trending Searches on @CRYPTO market 
https://t.co/eFMGpOktXH

$MINA $SHIB $MATIC $SOL $BNB $BTC $QUICK $ADA $ETH $LPT $SFUND $NFY $CVX https://t.co/d5CFITcKhl",0
2022-09-15 23:50:13+00:00,1570560650379919360,"gave away at least half a dozen 10x plays earlier than almost any other account (including $cvx $spell $raini $gmx and more)  without really gaining any traction

https://t.co/R62rWTeBnn",1
2022-09-15 23:44:47+00:00,1570559282458038272,"#ChevronCorp $CVX Daily #Stock Chart with 50 days #Fibonacci Retracement Levels
Fibonacci #Support Levels 159.49, 158.74, 153.73
Fibonacci #Resistance Levels 166.83, 188.02
Start #investing in #GlobalStocks at https://t.co/peLniHQjpl 
#Investor #Trading https://t.co/DIq4lDmL3B",0
2022-09-15 23:43:59+00:00,1570559080762318850,"Trending: DJIA

$AAPL -2.61 %
$INTC -1.41 %
$WMT -1.96 %
$DIS -2.09 %
$MSFT -3.39 %
$MCD -1.26 %
$BA -0.54 %
$V -2.59 %
$CVX -2.11 %
$JPM 0.87 %

https://t.co/WV3qS0lE4Q",2
2022-09-15 23:35:37+00:00,1570556976907812864,@VivekGRamaswamy Leaving more cash for $CVX and $XOM,0
2022-09-15 23:32:46+00:00,1570556259547648000,@_Slimezxn @starwiz_whizboi @Faka_of_West All these won’t matter in heaven 😔,0
2022-09-15 23:24:24+00:00,1570554153897988097,"#ChevronCorp $CVX Monthwise Daily High - Low Movement Box Plot
Avg day swing for last month is 3.22
Avg day swing for last 5 months is 4.18 https://t.co/PhjfjeJoko",0
2022-09-15 23:23:58+00:00,1570554045194182665,"Trending: DJIA

$AAPL -2.66 %
$INTC -1.58 %
$WMT -1.98 %
$DIS -2.04 %
$MSFT -3.48 %
$MCD -1.26 %
$BA -0.58 %
$V -2.29 %
$CVX -2.19 %
$JPM 0.94 %

https://t.co/WV3qS0lE4Q",2
2022-09-15 23:22:45+00:00,1570553740507353089,Rig count slowdown. Hz Permian rigs down about 10 the past two months. @ftenergy article today spurred more discussion. Poll time. 📊 Why are rigs retreating? Please share comments if able! $PXD $CVX $XOM https://t.co/ASMLQeGbTO,0
2022-09-15 23:05:08+00:00,1570549305160925184,"🔥 Forecast 🔥 #ConvexFinance $CVX (Rank:121🏁) price has fallen: -2.772% 🚨, Price: $4.83, Volatility: 9.522% ($0.6596), Price Target (24h): $6.93🔺 | 👁️  More: https://t.co/DkYrcxkLXC https://t.co/ILm306guOD",0
2022-09-16 23:55:52+00:00,1570924461918134276,@lar_gbo @GucciStarboi @ReaLPengG For your mind now you wise Abi?,1
2022-09-16 23:53:41+00:00,1570923913466744835,"@donuts_itm cvxFXS/Fxs on convex 22% in Cvx,crv and Fxs.
aFXS on concentrator 23.85 autocompounding.
They your best bet bro",3
2022-09-16 23:47:23+00:00,1570922326346301441,"We are glad to help this member reach his goal. Check out what he said in his updated review of our server https://t.co/MmIMKJhlRN

$CMCSA $PEP $SAP $XOM $ABBV $ABT $TM $CRM $ORCL $CVX $ASML $LLY $TMO $AMGN $AZN $NKECHL $COST $MCD $ACN $BMY $DHR $NEE $SNY $CHTR $MDT $TMUS https://t.co/Pthobeu9fs",0
2022-09-16 23:19:26+00:00,1570915292393656320,"$CVX (W) Looks like a date with 154 is back on deck, will support save it again? If not we see 150 up next https://t.co/WZe0YraDvP",0
2022-09-16 23:07:06+00:00,1570912188646428672,$CVX Awaiting Short Signal based off 9 signals on the 15-min chart. Free trial at https://t.co/OB4KuLJRo8 https://t.co/H9ykom9dvm,0
2022-09-16 22:39:35+00:00,1570905263057833986,"$NVDA 
We have two choice hold $NVDA or sell $NVDA . You decide!
https://t.co/aKBj4B4pGo

$PFE $ATUS $FB $ZOM $DMYI $AFRM $AEHR $SLB $NOK $XELA $VIPS $UNG $DRIP $SOXS $SOXL $GSAT $TZA $DATS $JPM $AUY $TNA $LVS $INTC $CVX $GM https://t.co/kPoyxjYBKZ",0
2022-09-16 22:29:44+00:00,1570902782789693440,"https://t.co/ZBTRgq18CE
Join now
$TSLA $NVDA  $MU $AMZN $MSFT $BABA $NFLX $ADBE $AXP $IBM $CSCO $CVX $INTC $DD $DIS $MCD $MMM $PG $TRV $UNH $NKE $UTX $VZ $WBA $WYNN $XLNX $ACN $FB $NFLX $DLTR $EA $SPY https://t.co/3e1yuB6M56",0
2022-09-16 22:28:30+00:00,1570902476399980544,@CredibleCrypto @ConnectoFive P.S. an altcoin/BTC bleed does not mean a altcoin bleed ... just saying as I read so much misunderstanding/nonsense about this in CT $BTC $CRV $CVX $HBAR $XRP,2
2022-09-16 22:25:08+00:00,1570901628743749632,@milivitori4 “Ahhhhhh tmnc”🤣,1
2022-09-16 22:02:34+00:00,1570895947655254016,"Volume significantly increased on $CVX 

It increased by 448.58% during the last 2 hours.⚠️",0
2022-09-17 23:57:40+00:00,1571287300159557632,@_Skurii @blaccmajek @ManLikeAkoh @Remmzor__ Olamide Dropped e no enter Top10,1
2022-09-17 23:55:25+00:00,1571286735702597632,"@unknown_cvx ""Good music is winning"" did that in anyway include anybody's name??... She barely just updated y'all to see what's popping on the charts, it's not that deep",0
2022-09-17 23:51:06+00:00,1571285647117148160,@TheCoiner5 @alle_sindhi @Tetranode I think his cvx is locked so no sell,2
2022-09-17 23:49:07+00:00,1571285151635709954,@Catalystophant Unna no deh shame🤣,12
2022-09-17 23:42:01+00:00,1571283361284624387,@IWishIWasTold @unknown_cvx @YinkuzJyde @tomicoker_ Maybe no be human being born am ... oh wait !! The parents na. Non living things cause them no be celeb. Bunch of hypocrites,3
2022-09-17 23:40:19+00:00,1571282934308503554,@30bg_stephan @SAMKLEF Lol Every na Wizkid fan For Superstar Era,0
2022-09-17 23:13:10+00:00,1571276101652971520,"$CVX has been added to the Best Stocks list with an EM of 31.0, market capitalization 284465.0 and a perfect timing 5.3. You can find it here https://t.co/HertQGOJZO https://t.co/fclSVAghrs",0
2022-09-17 23:03:53+00:00,1571273767195758594,"@unknown_cvx @YinkuzJyde @tomicoker_ Lmao be like say this pikin na criminal. E dey guilty, na why e use am",6
2022-09-17 23:02:44+00:00,1571273477038157824,"""September Dogs Of The Dow: Chevron’s 3.5% Is Better Than 3M’s 5.1% (NYSE:CVX)"" via @SeekingAlpha

Trending #convexfinance news with frequent shares and strong engagement across social media.

Social Insights: https://t.co/zN9POLUkUI $cvx

Source👇https://t.co/dpmf5bL2os",0
2022-09-17 22:52:35+00:00,1571270921456963586,@Ekitipikin Like if you know say yunno fit make ham for life.,0
2022-09-18 23:43:12+00:00,1571646050103951360,"#CVXUSDT Bear Alert!

5X Volume
Price:      4.549
5-min %: -0.022%
Volume:  $74,407
 
#crypto #whale #btc #eth #CVX $CVX https://t.co/cBM77eL96y",0
2022-09-18 23:30:57+00:00,1571642966640365569,"https://t.co/MmIMKJgO2f
Join now
$TSLA $NVDA  $MU $AMZN $MSFT $BABA $NFLX $ADBE $AXP $IBM $CSCO $CVX $INTC $DD $DIS $MCD $MMM $PG $TRV $UNH $NKE $UTX $VZ $WBA $WYNN $XLNX $ACN $FB $NFLX $DLTR $EA $SPY https://t.co/ZK9vgz7yHj",0
2022-09-18 23:18:13+00:00,1571639763740028930,"@ChrisScottsdale @himansu_desai @TeslaHistorian Whole market did not take a dump. Overpriced stocks such as $TSLA, pushed by an army of stock pumpers, however, got a haircut. Compare year to date returns on $TSLA vs $LMT $GD $XOM  $DVN $CVX https://t.co/XoPJlrjw3i",0
2022-09-18 23:16:11+00:00,1571639248851271686,@Kinpluto_inc @unknown_cvx @DoGudregardless @youngstar_nce @emmylambo7 @opeyemizulfah No mind am😂😂,1
2022-09-18 23:01:26+00:00,1571635538737643525,"#CVXUSDT Bear Alert!

10X Volume
Price:      4.55
5-min %: -0.13%
Volume:  $148,671
 
#crypto #whale #btc #eth #CVX $CVX https://t.co/ZM2CA54XzK",0
2022-09-18 23:01:23+00:00,1571635526645551104,@unknown_cvx @DoGudregardless @youngstar_nce @emmylambo7 @opeyemizulfah And you dey Lagos!!! 🤦‍♂️,4
2022-09-18 23:01:06+00:00,1571635454276943873,"#CVXUSDT Bear Alert!

5X Volume
Price:      4.546
5-min %: -0.22%
Volume:  $70,088
 
#crypto #whale #btc #eth #CVX $CVX https://t.co/gYurS9Np4S",0
2022-09-18 22:59:50+00:00,1571635136457838592,Wall Street USA Markets Better Valuation For 09/19/22 $JPM $BRK.A $BRK.B $BLK $GS $MS $BAC $WFC $COF $BK $SCHW  $QQQ $VOYA $MSFT $META $TSLA $TWTR $SQ $AAPL $T $AMZN $NFLX $GOOGL $LUV $DAL $ULCC $UAL $AAL $ALK $SAVE $SPCE $XOM $CVX $SUN $BP $OXY @SquawkCNBC @markets @SquawkStreet,1
2022-09-18 22:58:04+00:00,1571634690359951362,"💰💰💰💰💰💰💰💰💰💰💰💰💰💰💰💰💰Congrats to all Team members for making huge gains with Trade Ideas $CVX #CVX 

https://t.co/rEobNg7QQw",0
2022-09-18 22:52:14+00:00,1571633223654084608,@Kevin93853881 @AKChrismarlo I’m not your blud.,0
2022-09-19 23:57:04+00:00,1572011924505915394,"U.S  market movers Monday
Stay informed: https://t.co/m9nDvKCNFo

Dow Stocks
#Dow $DJI #WallStreet 
$JPM $V $AAPL  $GS $AXP $DIS $MSFT 
$MCD $AXP $HD $NKE $BA $MSFT $WMT
$CRM $CVX $CRM $CAT $UNH $DIS $CVX
$WBA $CRM $DOW $TRV $KO  $DOW $PG https://t.co/IpGKbAJODE",0
2022-09-19 23:54:41+00:00,1572011325735436289,Someone check on this nigha😹🖕,0
2022-09-19 23:53:49+00:00,1572011109523288066,@RabsonLee No be only popcaan na pop corn,0
2022-09-19 23:51:35+00:00,1572010546706190336,"$CVX is on the Opened trades list at EPSMomentum, with a price of 163.27 on 09/14/2022 and a current return of -4.18%. You can find it here https://t.co/26oCREe5gg https://t.co/YYI93HXCWU",0
2022-09-19 23:50:41+00:00,1572010320679374849,@SkyTex697 @Ebiloma01 @_AsiwajuLerry @Acedouglas1 Dunce,0
2022-09-19 23:47:26+00:00,1572009502828032000,"@fud_shark Agreed. My guess is that they will simply bribe CVX holders.

Prevents them from having to hold and lock any risk assets which they may be less interested in doing given its a public company.",5
2022-09-19 23:44:23+00:00,1572008734930440192,"Trending: DJIA

$AAPL 2.84 %
$MSFT 0.18 %
$INTC 0.89 %
$JNJ -0.54 %
$WMT 0.86 %
$MCD 0.95 %
$DOW 0.99 %
$CRM 1.20 %
$JPM 1.08 %
$CVX 0.08 %

https://t.co/WV3qS0l6fi",0
2022-09-19 23:40:46+00:00,1572007824271544320,@Azhure_Kylar *mom voice* You can have more RE as soon as you finish your CVX.,0
2022-09-19 23:40:07+00:00,1572007659985051655,"@0xCha0s I think @coinbase would likely just bribe CVX holders as they can get liquidity without holding/locking any risk assets. 

If they were to use CRV or CVX, CVX would be more cost efficient at the moment. https://t.co/ocrqJ16ZAP",5
2022-09-19 23:39:06+00:00,1572007404476272640,@Poltergeist234 @BayoSZN @Nfthuntguy @illustriousSneh @CazorlaHarbey Head to head Wiz and olamid?,0
2022-09-20 23:54:57+00:00,1572373782463152129,"U.S  market movers Tuesday
Stay informed: https://t.co/m9nDvKCNFo

Dow Stocks
#Dow $DJI #WallStreet 
$JPM $V $AAPL  $GS $AXP $DIS $MSFT 
$MCD $AXP $HD $NKE $BA $MSFT $WMT
$CRM $CVX $CRM $CAT $UNH $DIS $CVX
$WBA $CRM $DOW $TRV $KO  $DOW $PG https://t.co/K69fLVYHp0",0
2022-09-20 23:54:31+00:00,1572373671339036673,"TRADE IDEA⚔️ #PRESSIT 
TICKER📈 $CVX 🪔
LONG TRIGGER🔫156.85
LONG PT🎯 161.12
SHORT TRIGGER🔫154.35
SHORT PT🎯148.94 https://t.co/7EST0m8kTl",5
2022-09-20 23:50:18+00:00,1572372611690303489,@crypto_condom @fraxfinance $cvx to suffer too if this goes through 😢,1
2022-09-20 23:39:11+00:00,1572369813217095680,"@jellysmithrave Con artist cc wears ‘credible’mask

Runs multi-tiers pyramid ponzi w/HUNDREDS fakies/puppet accts in ALL Social feeds/CT/Discord/Paid to dupe newbs into p dump scams
$xrp $hbar $crv $cvx #NFT

&gt;10+DeceptiveTricks
incl fake TA
eg EW wave5
most recently👉whale bids,inefficiencies💩 https://t.co/t5YBKdebHv",5
2022-09-20 23:31:57+00:00,1572367994545651712,"#30mCandlesTA4Crypto | 🚨 📉 Biggest losers this last candle:

$EPX ➡️ -5.01%
$ANC ➡️ -1.91%
$RAD ➡️ -1.83%
$FLUX ➡️ -1.68%
$CVX ➡️ -1.61%

20/09/2022 @ 11:31pm UTC
Follow for regular updates
#cryptotrading #crypto #cryptomarket",0
2022-09-20 23:02:04+00:00,1572360472694775809,$COP $CVX $DCP NEW ARTICLE : Phillips 66: A Coiled Spring Yielding 4.7% https://t.co/9G1UkTEInq Get all the latest $COP related news here : https://t.co/yT58gg7Dsy,0
2022-09-20 22:57:55+00:00,1572359430787956736,"@Biohazard3737 Well, two years ago, CVX and other oil stocks felt so wrong to be buying there. Look at them this year...",2
2022-09-20 22:55:38+00:00,1572358852380889088,"#ChevronCorp $CVX Last 12 months Daily #StockMovement Histogram #Chart
Max downward movement was -6.7%
Max upward movement was 8.9%
Stock majorly moved between -1.66% and 1.96%
Start #investing in #GlobalStocks at https://t.co/peLniHQjpl 
#Investor https://t.co/WPlQkkQmn6",0
2022-09-20 22:53:49+00:00,1572358397957406723,"Top tweeted stocks:
$TSLA $AAPL $SPX $NFLX $F $NVDA $BYND $TWNK $OPEN $JPM $VALE $DVN $ASAN $WEAT $CORN $AMZN $PYPL $BABA $SOBR $SAVA $OXY $RIVN $MCD $CVX $MMM $NCLH $ARVL $WIX $NKLA $KGC $HUM $MLCO $IPOF $SLB $AMLX $WING $CI $LAZR $ITUB $SOYB $NAT $CALM 

 #stockstowatch https://t.co/2hRibJSPxG",1
2022-09-20 22:53:22+00:00,1572358284991991808,"Best Crypto to Buy Trending Today: $USTC, $APE, $HNT, $CHZ, $LUNC, $ALGO, $CVX, $LUNA, $QNT, $LDO, $IBAT
#LUNC #LUNCcommunity #TERRALUNACLASSIC #LUNA #Cryptocurrency #Crypto #TerraClassic
https://t.co/ZFK2TXaI1R",2
2022-09-21 23:50:15+00:00,1572734987291754498,"We are glad to help this member reach his goal. Check out what he said in his updated review of our server https://t.co/MmIMKJhlRN

$CMCSA $PEP $SAP $XOM $ABBV $ABT $TM $CRM $ORCL $CVX $ASML $LLY $TMO $AMGN $AZN $NKECHL $COST $MCD $ACN $BMY $DHR $NEE $SNY $CHTR $MDT $TMUS https://t.co/xepbV6qZ9p",0
2022-09-21 23:38:30+00:00,1572732028956839936,Town &amp; Country Bank &amp; Trust CO dba First Bankers Trust CO Buys 680 Shares of Chevron Co. (NYSE:CVX) https://t.co/aWp33CDpXL,0
2022-09-21 23:31:15+00:00,1572730205411622913,@tam_godwin @A_Abby_Abi @BuzzFeedFood Your work rate pass Kante own,1
2022-09-21 23:27:12+00:00,1572729185054990337,@unknown_cvx @_offixialrex @BSundayare Werey don jam talk leak him secret😂😂😂,1
2022-09-21 23:24:13+00:00,1572728434459033601,@_offixialrex @BSundayare Oh that’s what you do?,0
2022-09-21 23:04:00+00:00,1572723349293502470,"Top 10 Trending Searches on market 

https://t.co/CtKpUg4iNS

$MINA $SHIB $BNB $BTC $QUICK $ADA $ETH $LPT $SFUND $NFY $CVX $ENS https://t.co/PDB8ecePLn",0
2022-09-21 23:01:41+00:00,1572722764221407234,"#30mCandlesTA4Crypto | 🚨 📉 Lowest 14 periods #MFI now:

$COS ➡️ 11.81
$POLS ➡️ 15.397
$CVX ➡️ 17.639
$TKO ➡️ 18.113
$MULTI ➡️ 18.428

21/09/2022 @ 11:01pm UTC
Follow for regular updates
#cryptotrading #crypto #cryptomarket",1
2022-09-21 23:01:11+00:00,1572722640300969984,"Last #Signal Results  
  
$IOST    75.38%
$KSM    27.30%
#VET    83.38%
#CTSI    22.03%
$FTT    78.19%
$CVC    17.14%
#BTC    48.15%
#CVX    23.47%
#CTSI    80.46%
#ETC    94.19%
  
All Details on Bio Total Profit  549.69%",0
2022-09-21 23:01:11+00:00,1572722636773543942,"Last #Signal Results  
  
$IOST    75.38%
$KSM    27.30%
#VET    83.38%
#CTSI    22.03%
$FTT    78.19%
$CVC    17.14%
#BTC    48.15%
#CVX    23.47%
#CTSI    80.46%
#ETC    94.19%
  
All Details on Bio Total Profit  549.69%",0
2022-09-21 23:01:08+00:00,1572722626602180613,"Last #Signal Results  
  
$IOST    75.38%
$KSM    27.30%
#VET    83.38%
#CTSI    22.03%
$FTT    78.19%
$CVC    17.14%
#BTC    48.15%
#CVX    23.47%
#CTSI    80.46%
#ETC    94.19%
  
All Details on Bio Total Profit  549.69%",0
2022-09-22 23:33:03+00:00,1573093044081106954,"Have to be careful with hopium here since any bit of narrative might spark fomo in this bear market, but the FDV is just too low to pass on it entirely. This is as close as it gets to a ""moonshot"". Comparable to $CVX and $YFI success stories imo.",6
2022-09-22 23:33:02+00:00,1573093041841258501,"-&gt; about to launch on mainnet

-&gt; they're getting a $CRV gauge soon to incentivize liquidity through $CVX bribes = more buying from $CRV farmers 

-&gt; last but not least: the actual usecase makes sense (see $YFI success) and the cashflows earned will be redirected to $CNC lockers",1
2022-09-22 23:27:23+00:00,1573091619204911106,"@TIME_1011 In open maps such as storms and unexplored rocks, CVX is stronger because it can carry missiles, but in complex maps such as the Icelands of Islands, Izumo is stronger because it has high mobility and is strong in close quarters battles.
I would choose Izumo.",1
2022-09-22 23:27:13+00:00,1573091577593208832,"@TIME_1011 The Izumo's strength is its ability to carry a mix of two types of helicopters. However, the performance of mother ships other than mobility is higher in CVX.",1
2022-09-22 23:27:04+00:00,1573091539286659072,"U.S  market movers Thursday
Stay informed: https://t.co/m9nDvKCNFo

Dow Stocks
#Dow $DJI #WallStreet 
$JPM $V $AAPL  $GS $AXP $DIS $MSFT 
$MCD $AXP $HD $NKE $BA $MSFT $WMT
$CRM $CVX $CRM $CAT $UNH $DIS $CVX
$WBA $CRM $DOW $TRV $KO  $DOW $PG https://t.co/RSPrcL9IAi",2
2022-09-22 23:19:41+00:00,1573089680509513728,"@Lubow2 Ya saw that. Sounds like their omnipools are going to optimize for both liquidity and incentives along with stacking CRV + CVX bribes against the APR....

Methinks omnipools are going to print",1
2022-09-22 23:16:44+00:00,1573088941884211200,"If you have $BP or $CVX in your portfolio, pay attention!
https://t.co/iFesh0CWjK https://t.co/LZclJV46hk",0
2022-09-22 23:13:03+00:00,1573088011935432709,"Strongest Movers in #BTC pair
 1 #XRP $xrp 
 2 #Chiliz $chz 
 3 #Algorand $algo 
 4 #LEOToken $leo 

#altcoins Bullish in BTC
 1 #Ape $ape 
 2 #Chiliz $chz 
 3 #ConvexFinance $cvx 
 4 #CelsiusNetwork $cel 

(excluding low caps)

The market is 🚀🚀🚀
#Cryptocurrency #Crypto",0
2022-09-22 23:03:02+00:00,1573085493734014977,"Strongest Movers in #USDT
 1 #Chiliz $chz 
 2 #Algorand $algo 
 3 #LEOToken $leo 
 4 #Stellar $xlm 

Strengthening #alts
 1 #LidoDAO $ldo 
 2 #ConvexFinance $cvx 
 3 #Kava $kava 
 4 #OKB $okb 

out of Top coins

#Crypto #Altcoins",0
2022-09-22 23:00:12+00:00,1573084778760441858,"✨ #CVX 
💵 Current Price: 4.764 
📱 Look other coin infos with our app: https://t.co/vNpxF6rnmg https://t.co/Dt4ohycGTw",0
2022-09-23 23:59:03+00:00,1573461976822554625,@jamiu_BIN_ladin @Tife_12 Don’t die for yansh,1
2022-09-23 23:54:20+00:00,1573460790417424384,@ogundele_oluwa @Goldenlover0 @cuche43 @officialsizzu @_AsiwajuLerry Ratio no deh tire you?,0
2022-09-23 23:07:25+00:00,1573448983468560417,"Hope you enjoyed

Protocols mentioned:
@redactedcartel $BTRFLY
@GMX_IO $GMX
@ConvexFinance $CVX
@idlefinance $IDLE
@saddlefinance $SDL
@PlutusDAO_io $PLS
@bobanetwork
@traderjoe_xyz $JOE",4
2022-09-23 23:07:25+00:00,1573448981681963008,"&gt;Pirex Updates [cont]:
- Pirex owns more than 1% $CVX supply

&gt; ""Nothing to talk about Dinero for a while""
&gt; Integration with a new protocol within next few weeks
&gt; Claim page will have a ""reinvest button""
&gt; Expert Mode for pxCVX ""sooner rather than later""",1
2022-09-23 23:07:22+00:00,1573448971976167449,"&gt;Pirex Updates:
- GMX is the next protocol to be integrated
- Pirex seeing a 4-5% growth in $CVX deposits week over week
- Regarding GMX, users can deposit $GLP and $GMX, get $pxGLP and $pxGMX
- Already eyeing a version 2 of Pirex. Protocol built from the ground up
- $6M in CVX",0
2022-09-23 23:04:33+00:00,1573448261276344320,"One should feel pretty confident that BidenHarris Petroleum sold about 135,000,000 barrels of oil in 2Q and 3Q. And it looks like BHA was #2 oil supplier in the U.S. in 2Q, coming in just behind CVX and 8% ahead of XOM. #EFT #OOTT",2
2022-09-23 23:03:03+00:00,1573447883055157253,"Strongest Movers in #USDT
 1 #Cronos $cro 
 2 #OasisNetwork $rose 
 3 #Helium $hnt 
 4 #Algorand $algo 

Strengthening #alts
 1 #Helium $hnt 🔥
 2 #Tezos $xtz 🔥
 3 #XRP $xrp 
 4 #ConvexFinance $cvx 

out of Top coins

DYOR",0
2022-09-23 23:00:02+00:00,1573447126113214464,"Nice print for $CVX Size: 1221819 Price: 144.77 Amount: $176,882,736.63 Time: 1900
See more: https://t.co/ckDL2K0gVd
Join https://t.co/JWvlYbdLod to get REAL TIME prints.
Runners 📈: https://t.co/VC1LdPHaJR
Losers 📉: https://t.co/9MWV4THfhQ
Gappers 🪜: https://t.co/bHQKF1W40n",0
2022-09-23 22:57:12+00:00,1573446410976088067,#short #watchlist for #trading on #nyse #nasdaq between $100 and $150: $AMR $BA $CHRD $COP $CVX $FANG $GUSH $HES $VDE $WEX $XOP,0
2022-09-23 22:52:09+00:00,1573445140953419789,Sorry if i havent been streaming much this week and ive been lurking in some streams. Work has been kinda shit this week. Ill be on tomorrow trying to chase that CVX knife record.,3
2022-09-24 23:53:00+00:00,1573822841128189953,"The code from @CurveFinance is very hard to understand so if you can build it on it, you're most likely very competent

$CNX &lt; $CVX &lt; $CRV

Ooo its time. 🚀🔥 https://t.co/V8Qz89Inml",45
2022-09-24 23:52:01+00:00,1573822595908050944,"10 Dividends Stocks that you should be looking at since the market is fairly cheap right now

1. $HD 🔨 
2. $AAPL 🍎 
3. $SBUX ☕️ 
4. $LMT ✈️ 
5. $MSFT ☁️ 
6. $BAC 🏦 
7. $JNJ 💊 
8. $O 🏬 
9. $DE 🚜 
10. $CVX ⛽️",3
2022-09-24 23:49:52+00:00,1573822053039210496,"Fundamentals can tell you what to trade, and technicals can tell you when to trade them.

$tsla $spy $msft $nflx $amzn $meta $aapl $twtr $wish $litm $gsun $uvxy $voo $cvx $mo $athx $xom $jz $xle $zm $oxy $f $amd $ccl $nvda $itub $vale",0
2022-09-24 23:44:17+00:00,1573820647922335746,@EJEH_Don001 @Eddy_gaga0 @rich__jeremiah @dammy_krane Comprehension hard for you,0
2022-09-24 23:37:42+00:00,1573818990778060802,#50% Profit on #CVX/USDT – LIVE FREE Crypto BOT copied all Signals via Cornix Bot in Account – Cryptocurrency Trading BOT https://t.co/yxwjrz8If6,0
2022-09-24 23:37:28+00:00,1573818934473936896,#50% Profit on #CVX/USDT – LIVE FREE Crypto BOT copied all Signals via Cornix Bot in Account – Cryptocurrency Trading BOT https://t.co/UJB24P58mF,0
2022-09-24 23:29:25+00:00,1573816908348116993,"Convex Finance: 13 unlocks later, CVX stands far from investor anticipation  https://t.co/FhXekOf8bD",0
2022-09-24 23:29:16+00:00,1573816868153982979,"Convex Finance: 13 unlocks later, CVX stands far from investor anticipation  https://t.co/JQ5xYsOQ5p",0
2022-09-24 23:26:05+00:00,1573816069789306887,"Which stock is the best to invest in? Compare $BP vs. $CVX.
https://t.co/iFesh0Couc https://t.co/nXDx7Ft7xb",0
2022-09-24 23:22:16+00:00,1573815109041922050,"Convex Finance: 13 unlocks later, CVX stands far from investor anticipation  https://t.co/YjF0IiipAJ",0
2022-09-25 23:57:25+00:00,1574186340631154689,@EllyDtrades $CVX and $F please,0
2022-09-25 23:52:53+00:00,1574185199130271744,"3,267 $ worth of $CVX market bought on Binance at 4.6000 $. 
💰💰",1
2022-09-25 23:33:21+00:00,1574180284148617218,I still think $CVX will survive this bear market. Its one of the only coins I've held all the way down (partially because I am locked obviously). Added more today. Slowly accumulating and getting paid 35% to hold it.,0
2022-09-25 23:31:52+00:00,1574179913321553920,"#30mCandlesTA4Crypto | 🚨 📈 Strongest #MACD buy signals now:

$TWT ➡️ 0.079%
$CVX ➡️ 0.064%
$MBOX ➡️ 0.041%
$ETH ➡️ 0.039%
$LINK ➡️ 0.038%

MACD crossed above signal
25/09/2022 @ 11:31pm UTC
#cryptocurrencies #trading #cryptotrading #tradingtips",0
2022-09-25 23:20:56+00:00,1574177160981512194,Terra Classic LUNC Bulls Buying more as the price falls https://t.co/ahzXeEGnX8 $gme $ame $SLB $HAL $BKR $TS $NOV $CHX $VAL $FTI $WHD $WFRD $LBRT $XPRO $USAC $NEX $RES $OII $AROC $CLB $PUMP $DNOW $VTOL $DRQ $WTTR $SLCA $BOOM $SHEL $XOM $CVX,0
2022-09-25 22:47:29+00:00,1574168741495144452,"$IBM $TSLA $EKSO $PLUG $MU $AMD $EXAS $FNGR
$OSTK $NVDA $CVX $VERI $IZEA $DVAX $FCEL $PTON $CLSN $ONVO $AGEN $VUZI $APPS $SEED
$SRAX   Big Lou exposing Naked shorts 

https://t.co/dXgDhVwkaP",12
2022-09-25 22:08:38+00:00,1574158964970999808,"#ChevronCorp $CVX Last 6 months Daily #StockMovement Histogram #Chart
Max downward movement was -6.7%
Max upward movement was 8.9%
Stock majorly moved between -2.01% and 1.79%
Start #investing in #GlobalStocks at https://t.co/peLniHPLzN 
#Investor https://t.co/KXYUBCvwuT",0
2022-09-25 22:04:47+00:00,1574157994824286209,"3,258 $ worth of $CVX market bought on Binance at 4.6000 $. 
💰📈📈",0
2022-09-25 21:43:07+00:00,1574152545936842755,$CVX Trading Ideas | Awaiting Buy signal. 60% Profitability based on 6 trades. Profit factor is 6.61. Learn more at https://t.co/uNaBDyBhvH. #CVXSTOCK https://t.co/6AjwY70S9d,0
2022-09-25 21:36:52+00:00,1574150971042762754,"10,455 $ worth of $CVX market bought on Binance at 4.6000 $. 
🧙🧙⚠️",0
2022-09-26 23:58:19+00:00,1574548954221453313,@Mor3nik3jimi @kusssman Who go revive olamid?,1
2022-09-26 23:46:02+00:00,1574545862856151041,"Chevron halted production at two platforms in the Gulf of Mexico ahead of Hurricane Ian. Chevron ""will continue to closely monitor the storm and remains focused on the safety of our workforce,"" the company said in an emailed statement. $CVX $DIA $YM #HurricaneIan #trading #stocks https://t.co/ocdf6LNoY4",3
2022-09-26 23:45:53+00:00,1574545828269772802,"MARKET UPDATE September 26th 2022 

$AAPL $TSLA $QQQ $SPY $GOOG $AMZN $OXY $CVX https://t.co/6umyUeTRTu",4
2022-09-26 23:27:42+00:00,1574541249280987155,"@Rose0verdose Look at Eric Nuttall he has a list of cdn o&amp; g, read the balance sheets and income statements and choose the ones you like, buy the supermajors, e.g. cvx xom etc... Spread it all around ... If we have an energy crisis, as predicted, you will become rich in 2 years",0
2022-09-26 23:17:34+00:00,1574538702285688842,"https://t.co/tXysTF24p2
Join now
$TSLA $NVDA  $MU $AMZN $MSFT $BABA $NFLX $ADBE $AXP $IBM $CSCO $CVX $INTC $DD $DIS $MCD $MMM $PG $TRV $UNH $NKE $UTX $VZ $WBA $WYNN $XLNX $ACN $FB $NFLX $DLTR $EA $SPY $SPX $DJIA $HD $GS $BA $GDX $VZ $WDC $AMD $ADSK $V $CAT $JPM https://t.co/KoO8cJF6Vg",0
2022-09-26 23:00:05+00:00,1574534300703535104,"Nice print for $CVX Size: 1309992 Price: 140.96 Amount: $184,656,472.32 Time: 1900
See more: https://t.co/ckDL2K0OKL
Join https://t.co/JWvlYbejdL to get REAL TIME prints.
Runners 📈: https://t.co/VC1LdPHIzp
Losers 📉: https://t.co/9MWV4THN7o
Gappers 🪜: https://t.co/bHQKF1WBPV",0
2022-09-26 22:54:51+00:00,1574532983725248512,"BIDEN: COMPANIES RUNNING GAS STATIONS NEED TO BRING DOWN PRICE OF GASOLINE AT THE PUMP “NOW”

Will they listen?

$XOM $CVX #Oil",0
2022-09-26 22:30:06+00:00,1574526755032948769,"Nice print for $CVX Size: 1309992 Price: 140.96 Amount: $184,656,472.32 Time: 1830
See more: https://t.co/ckDL2K0gVd
Join https://t.co/JWvlYbdLod to get REAL TIME prints.
Runners 📈: https://t.co/VC1LdPHaJR
Losers 📉: https://t.co/9MWV4THfhQ
Gappers 🪜: https://t.co/bHQKF1W40n",0
2022-09-26 22:29:04+00:00,1574526496857030656,"We are glad to help this member reach his goal. Check out what he said in his updated review of our server 
https://t.co/nbm9ktQzvT

$CMCSA $PEP $SAP $XOM $ABBV $ABT $TM $CRM $ORCL $CVX $ASML $LLY $TMO $AMGN $AZN $NKECHL $COST $MCD $ACN $BMY $DHR $NEE $SNY $CHTR $MDT $TMUS https://t.co/ISkPQBDp1i",0
2022-09-26 22:28:18+00:00,1574526302354300962,"#cvx #cvxusdt bull alert
Download @scorehood to analyze your favourite coin! 15 days free trial!

https://t.co/jrgZWv4VO6

#btc #bitcoin #eth #ethereum #altcoins #cryptocurrency #avax #bnb #binance #crypto #nftcommunity #trade #sol #matic #ada #xrp #link https://t.co/1KFYNjEW8h",4
2022-09-27 23:29:36+00:00,1574904115569860630,"https://t.co/ZBTRgq0AN6
Join now
$TSLA $NVDA  $MU $AMZN $MSFT $BABA $NFLX $ADBE $AXP $IBM $CSCO $CVX $INTC $DD $DIS $MCD $MMM $PG $TRV $UNH $NKE $UTX $VZ $WBA $WYNN $XLNX $ACN $FB $NFLX $DLTR $EA $SPY https://t.co/DUIxPxwXYB",0
2022-09-27 23:16:26+00:00,1574900805437726733,"How to make the right investment? Compare $BP vs. $CVX?
https://t.co/iFesh0Couc https://t.co/rlHv1CO9fL",0
2022-09-27 22:59:30+00:00,1574896540908670976,"$cvx Top analyst price target for next week🛰️
 https://t.co/jFJUptavu4",0
2022-09-27 22:54:13+00:00,1574895211116826624,"Short Interests of Chevron, $CVX : +26.14% MoM

#options #stocks $SPY 

Check out our tool at: 
https://t.co/LAvUlvRUG9 https://t.co/CXgrObAvqK",0
2022-09-27 22:41:44+00:00,1574892069491015680,"What is the Intrinsic Value of Chevron (CVX)? 
$CVX Stock Analysis: 
https://t.co/4PvdizkJsE https://t.co/F0CPpmTNtK",0
2022-09-27 22:38:35+00:00,1574891278764056585,"We are glad to help this member reach his goal. Check out what he said in his updated review of our server https://t.co/ZBTRgq0AN6

$CMCSA $PEP $SAP $XOM $ABBV $ABT $TM $CRM $ORCL $CVX $ASML $LLY $TMO $AMGN $AZN $NKECHL $COST $MCD $ACN $BMY $DHR $NEE $SNY $CHTR $MDT $TMUS https://t.co/8dto1Pp12I",0
2022-09-27 22:32:34+00:00,1574889765463150592,"#ALTCOINS are going up! Use https://t.co/Zx21aDT83b to track every coin, including advanced metrics not available elsewhere.

#BTC #ETH $QNT $GMT $RSR $UNI $NEO $CEL $MKR $LINK $CVX $CELO $HNT $CAKE $LEO $TON $KSM $AAVE $XDC $OKB https://t.co/J44wqNExol",0
2022-09-27 22:31:30+00:00,1574889497627697154,@DJ_TUNEZ @unknown_cvx Omo @DJ_TUNEZ just Dey chop life dey go,2
2022-09-27 22:28:45+00:00,1574888804594458629,@RichKarlDY1 @symplyDAPO Wetin you deh talk no make sense😹,15
2022-09-27 22:24:35+00:00,1574887756152684545,"@0xngmi duration of staking lock ups: 
ex. 
cvx 16 weeks
aave 10 days etc",11
2022-09-28 23:58:58+00:00,1575273893635715072,"https://t.co/ZBTRgq18CE
Join now
$TSLA $NVDA  $MU $AMZN $MSFT $BABA $NFLX $ADBE $AXP $IBM $CSCO $CVX $INTC $DD $DIS $MCD $MMM $PG $TRV $UNH $NKE $UTX $VZ $WBA $WYNN $XLNX $ACN $FB $NFLX $DLTR $EA $SPY https://t.co/CgX2wwwteG",0
2022-09-28 23:58:46+00:00,1575273843748442116,"DOW $DIA Top Gainers during today  $HD $BA $DIS $CVX 
        
Learn more: https://t.co/kcKVVyawWe https://t.co/FeD3vzAmhU",0
2022-09-28 23:58:32+00:00,1575273787234615297,"#ChevronCorp $CVX chart suggests #Fibonacci based #Resistance Levels are 146.1,146.14,146.68
and #Support Levels are 145.61,144.31,143.21
Start #investing in #GlobalStocks at https://t.co/peLniHQjpl
#Investor #Trading #investing",0
2022-09-28 23:58:32+00:00,1575273784558637056,"#ChevronCorp $CVX DailyChart-SMAandFibonacciSupport-Resistance
Stock trading below 200SMA
20SMA at 154.87, 50SMA at 155.59, 200SMA at 151.21 https://t.co/WFKBztLXXO",0
2022-09-28 23:54:16+00:00,1575272710816538626,"Markets at a Glance 09.28.22 https://t.co/tHgjtruXzS The $VIX closed at 30.18 – down 2.42 $AAPL $CAT $CVX Janet Yellen, US Treasury Sec'y may be replaced after mid-terms. #yellen #Treasury",0
2022-09-28 23:52:19+00:00,1575272223178358791,"🚀20% #STAKING APR! @MoonbeamNetwork $GLMR! 🤑

$waves $AVA #news $AAPL $NVDA $TSLA $AMZN #WSB #OOTT $GLD $QQQ $AMC $FB  #wallstreetbets $GME $goog $ICP $SHIB $GRT $CAKE #DDTG $MINA $QUICK $LPT $SFUND $NFY $CVX $ENS $ERG $ETC #Stocks #daytrading $sweat #investing $gmt $oax $cash",1
2022-09-28 23:46:08+00:00,1575270667888562181,"@Eddiegami It'd sell less.  Capcom's special editions tend to do worse than the vanilla game--the only exception I can think of is CVX, and that's just because the PS2 had WAAAAY more users than the Dreamcast.  3 was always the also-ran middle child between RE2 and 4, which are usually",0
2022-09-28 23:44:18+00:00,1575270203247964160,"We are glad to help this member reach his goal. Check out what he said in his updated review of our server https://t.co/ZBTRgq18CE

$CMCSA $PEP $SAP $XOM $ABBV $ABT $TM $CRM $ORCL $CVX $ASML $LLY $TMO $AMGN $AZN $NKECHL $COST $MCD $ACN $BMY $DHR $NEE $SNY $CHTR $MDT $TMUS https://t.co/tjS2dL2Uxx",0
2022-09-28 23:43:45+00:00,1575270066693603330,"@FunTokenomics @RampCapitalLLC Wrong. XOM CVX both had 4% early today, you can hold 10 years, might grow divs, and backed by real assets the world is short of.",0
2022-09-28 23:34:13+00:00,1575267667312668672,"Short Interests of Chevron, $CVX : +26.14% MoM

#options #stocks $SPY 

Check out our tool at: 
https://t.co/LAvUlvRUG9 https://t.co/ZDdY2bxWGB",0
2022-09-29 23:58:09+00:00,1575636077968519168,"$cvx Top analyst price target for next week *-*-*
https://t.co/2XAeblTgec",0
2022-09-29 23:56:44+00:00,1575635722895097857,"We are glad to help this member reach his goal. Check out what he said in his updated review of our server https://t.co/MmIMKIZcDF

$CMCSA $PEP $SAP $XOM $ABBV $ABT $TM $CRM $ORCL $CVX $ASML $LLY $TMO $AMGN $AZN $NKECHL $COST $MCD $ACN $BMY $DHR $NEE $SNY $CHTR $MDT $TMUS https://t.co/tgBQna96Jv",0
2022-09-29 23:54:42+00:00,1575635209994719232,$CVX Awaiting Buy Signal based off 10 signals on the 15-min chart. Free trial at https://t.co/UfR2YD3uSh https://t.co/DURUhcdm84,0
2022-09-29 23:52:13+00:00,1575634583474696192,"$cvx Top analyst price target for next week ....''
https://t.co/2XAeblB704",0
2022-09-29 23:27:32+00:00,1575628371979300864,"#ChevronCorp $CVX Last 6 months Daily #StockMovement Line #Chart
Max downward movement was -6.7%
Max upward movement was 8.9%
Stock majorly moved between -2.04% and 1.91%
Start #investing in #GlobalStocks at https://t.co/peLniHQjpl 
#Investor https://t.co/erYt6bp4Ge",0
2022-09-29 23:27:09+00:00,1575628276739215360,"We are glad to help this member reach his goal. Check out what he said in his updated review of our server https://t.co/ZBTRgq18CE

$CMCSA $PEP $SAP $XOM $ABBV $ABT $TM $CRM $ORCL $CVX $ASML $LLY $TMO $AMGN $AZN $NKECHL $COST $MCD $ACN $BMY $DHR $NEE $SNY $CHTR $MDT $TMUS https://t.co/3qxrs8HJwH",0
2022-09-29 23:05:01+00:00,1575622704966795265,"👎Top losers of the last hour👎 

🔴 $XRP $0.47982 📉 -3.86002802% 
🔴 $XLM $0.11506 📉 -2.28968409% 
🔴 $RSR $0.00811 📉 -1.37715764% 
🔴 $EOS $1.20275 📉 -1.13959405% 
🔴 $CVX $4.90378 📉 -0.96003143% 

👉 10% off on Binance Futures https://t.co/UmapEUUjlD",0
2022-09-29 23:00:15+00:00,1575621507417460736,"📉 Biggest Losers (1 hr) 📉
XRP $XRP -3.74% ❄️
Reserve Rights $RSR -1.35% ❄️
Stellar $XLM -1.27% ❄️
EOS $EOS -1.13% ❄️
Convex Finance $CVX -1.12% ❄️",0
2022-09-29 22:49:46+00:00,1575618868109680640,"U.S  market movers Thursday
Stay informed: https://t.co/m9nDvKkErg

Dow Stocks
#Dow $DJI #WallStreet 
$JPM $V $AAPL  $GS $AXP $DIS $MSFT 
$MCD $AXP $HD $NKE $BA $MSFT $WMT
$CRM $CVX $CRM $CAT $UNH $DIS $CVX
$WBA $CRM $DOW $TRV $KO  $DOW $PG https://t.co/9i8vJX1Hlj",0
2022-09-29 22:47:57+00:00,1575618411823972352,$CVX: Chevron: FreeWire Technologies to make available battery-integrated EV charging equipment for CVX branded... https://t.co/8sV0CPLcnw,0
2022-09-30 23:59:48+00:00,1575998880126103552,"@cade_carter1 @DevoutDriller Correct, and let’s throw costs in as well cuz you couldn’t pay me to participate in a CVX or XTO operated development.",2
2022-09-30 23:57:09+00:00,1575998214452695040,@michaeljoshua82 @toomeechyinda0 @__alabi @petiteonsteroid Wetin you know bout fashion?,0
2022-09-30 23:52:44+00:00,1575997101636431877,"@jaynmotion @LousyPseudonym @lulu742 @BillPascrell Wrong again! I invest in oil stocks. They had the lowest price in 2019. Check it out, XOM, OXY, CVX and MRO. While big tech companies were so high pre pandemic level.",0
2022-09-30 23:31:18+00:00,1575991709993172992,"We are glad to help this member reach his goal. Check out what he said in his updated review of our server https://t.co/MmIMKJhlRN

$CMCSA $PEP $SAP $XOM $ABBV $ABT $TM $CRM $ORCL $CVX $ASML $LLY $TMO $AMGN $AZN $NKECHL $COST $MCD $ACN $BMY $DHR $NEE $SNY $CHTR $MDT $TMUS https://t.co/dJEQCxyjQs",0
2022-09-30 23:19:49+00:00,1575988819450822657,... but perhaps even more so is the potential value of the $ctr and $clev tokens themselves. Tiny implied marketcaps on high revenue sharing coins ( $ctr 5m supply x $1.17/ctr = 5.85m mcap) &amp; ( $clev assumed 2m total possible supply × 1 cvx( 5$) = 10m mcap),1
2022-09-30 23:19:46+00:00,1575988805727064066,"The synergy between @0xconcentrator and @0xC_Lever has some truly mind boggling incoom potential for $crv, $cvx and stablecoin farmers! https://t.co/Op2yjWqbTB",44
2022-09-30 23:17:15+00:00,1575988173481873408,@Pascaliroro @taylor_dave19 @30bg_stephan Na Wetin dem deh teach you for sch be that?,0
2022-09-30 22:35:52+00:00,1575977759721259008,Excuse me that should have been sold my #CVX &amp; #XOM &amp; #XOP,0
2022-09-30 22:30:44+00:00,1575976466755383296,"@PasameZelda I think they should remake 1, 0, cvx and than eventually dino crisis.",0
2022-09-30 22:17:32+00:00,1575973144602374144,@BlackbwoyL @Kevin36644714 @westclean4 @Ms_Fej Don’t*,0
